[
  {
    "slug": "sycamore-loan-redesign",
    "titleLead": "SYCAMORE'S",
    "title": "LOAN APPLICATION REDESIGN",
    "summary": "Redesigning a fragmented, manual loan flow into a fully automated, end-to-end self-serve experience — improving trust, reducing drop-off, and tightening repayment security.",
    "tags": [
      "MOBILE APP",
      "PRODUCT DESIGN",
      "Prototyping"
    ],
    "meta": {
      "role": "Lead Product Designer",
      "timeline": "4 Weeks — Q4 2025",
      "tools": [
        "Figma",
        "Miro",
        "Coda",
        "Microsoft Clarity"
      ]
    },
    "live": {
      "url": "https://apps.apple.com/ng/app/sycamore-save-invest-borrow/id1592757960",
      "label": "View Live App"
    },
    "thumbnail": {
      "src": "/images/projects/loan-app/thumbnail.png",
      "alt": "Sycamore loan application redesign screens",
      "width": 4528,
      "height": 2280
    },
    "heroDevices": [
      {
        "src": "/images/projects/loan-app/hero-1.png",
        "alt": "Loan app dashboard"
      },
      {
        "src": "/images/projects/loan-app/hero-2.png",
        "alt": "Loan selection screen"
      },
      {
        "src": "/images/projects/loan-app/hero-3.png",
        "alt": "Eligible loan offer screen"
      },
      {
        "src": "/images/projects/loan-app/hero-4.png",
        "alt": "Loan disbursed confirmation"
      }
    ],
    "accentColor": "#331B17",
    "order": 1,
    "sections": {
      "overview": {
        "eyebrow": "OVERVIEW",
        "blocks": [
          {
            "kind": "text",
            "paragraphs": [
              "Sycamore is a digital finance platform offering loans, savings, investments, and other financial services to users across Nigeria. The loan application flow was functional but deeply fragmented — users couldn't complete the journey fully within the app. After several steps, applications required manual follow-up from a Sycamore representative, creating friction and uncertainty for users while adding operational bottlenecks for the business. At the same time, weak repayment security was driving higher default risk and excess manual verification work."
            ]
          },
          {
            "kind": "video",
            "src": "/images/projects/loan-app/walkthrough.mp4",
            "poster": "/images/projects/loan-app/hero.png",
            "caption": "Interactive prototype walkthrough",
            "autoplay": true,
            "loop": true,
            "muted": true
          }
        ]
      },
      "problem": {
        "eyebrow": "PROBLEM",
        "blocks": [
          {
            "kind": "text",
            "paragraphs": [
              "Users were dropping off at three critical points: the eligibility check, the document upload step, and the final review screen. Interviews revealed confusion around 'what happens next' and anxiety about whether they were eligible for the amount they were requesting. The existing design provided no progress indication, and offered no reassurance throughout."
            ]
          },
          {
            "kind": "bullets",
            "items": [
              "Loan applications were not fully automated — they required human follow-up to complete",
              "Multi-step identity verification was confusing and error-prone for users",
              "No progress indicators — approval timelines felt unpredictable",
              "Loan terms and repayment expectations were unclear, leading to anxiety and drop-off",
              "Ops teams handled excessive manual follow-ups that could have been resolved in-app",
              "Repayment security was weak, contributing to higher default risk"
            ]
          },
          {
            "kind": "gallery",
            "columns": 2,
            "images": [
              {
                "src": "/images/projects/loan-app/before.png",
                "alt": "Previous loan application design",
                "width": 4544,
                "height": 4043
              }
            ]
          }
        ]
      },
      "goals": {
        "eyebrow": "GOALS",
        "blocks": [
          {
            "kind": "text",
            "paragraphs": [
              "The brief was both a UX and a systems challenge. Success meant delivering a better user experience and a more defensible business model — simultaneously."
            ]
          },
          {
            "kind": "bullets",
            "items": [
              "Design a fully automated flow that requires little to no manual follow-ups",
              "Decrease application completion time to 30 minutes from 15 minutes",
              "Reduce loan approval time to 6 hours (from 3 days) for amounts under 30 million and 24 hours for those over",
              "Cut defaults on repayments by 60%"
            ]
          }
        ]
      },
      "process": {
        "eyebrow": "PROCESS",
        "blocks": [
          {
            "kind": "text",
            "paragraphs": [
              "We ran a week's discovery sprint before touching any design files. This grounded every decision in observed behaviour rather than assumption."
            ]
          },
          {
            "kind": "bullets",
            "items": [
              "Session replay analysis (Microsoft Clarity) to identify exact drop-off points",
              "Support ticket review to understand users' confusion",
              "6 contextual user tests & interviews",
              "End-to-end journey mapping including internal ops steps, not just user actions",
              "Competitive analysis: Cowrywise, Carbon, FairMoney, Kuda",
              "Collaborated with product, engineering, & risk teams to redefine verification & approval logic",
              "3 rounds of prototype testing after designs — before implementation"
            ]
          },
          {
            "kind": "image",
            "image": {
              "src": "/images/projects/loan-app/process-map.png",
              "alt": "Loan application process mapping diagram",
              "caption": "End-to-end process mapping",
              "width": 4544,
              "height": 1813
            },
            "width": "bleed"
          }
        ]
      },
      "design": {
        "eyebrow": "DESIGN",
        "blocks": [
          {
            "kind": "text",
            "paragraphs": [
              "Three decisions had the biggest structural impact on both the user experience and business outcomes."
            ]
          },
          {
            "kind": "bullets",
            "items": [
              "Progressive disclosure — broke requirements into stages so users only saw what they needed at each step",
              "Real-time eligibility checks surfaced early, so users knew their status before investing further effort",
              "Automated bank mandate integrated directly into the flow to secure repayments upfront",
              "Contextual tooltips added at high-error fields to reduce form abandonment"
            ]
          },
          {
            "kind": "gallery",
            "columns": 2,
            "images": [
              {
                "src": "/images/projects/loan-app/after.png",
                "alt": "Redesigned loan application screen",
                "width": 4544,
                "height": 7671
              },
              {
                "src": "/images/projects/loan-app/hero.png",
                "alt": "Redesigned loan application screens",
                "width": 4528,
                "height": 1612
              }
            ]
          }
        ]
      },
      "impact": {
        "eyebrow": "IMPACT",
        "blocks": [
          {
            "kind": "text",
            "paragraphs": [
              "After shipping the redesign in September 2025, we tracked metrics over 8 weeks:"
            ]
          },
          {
            "kind": "metrics",
            "metrics": [
              {
                "value": "+$9.7M",
                "label": "Disbursed Loan Amount"
              },
              {
                "value": "5 HRS",
                "label": "Avg. Loan Approval Time"
              },
              {
                "value": "-34%",
                "label": "Drop-off Reduction"
              },
              {
                "value": "+22%",
                "label": "Repeat Applications"
              },
              {
                "value": "+40.05%",
                "label": "Feature Adoption Rate"
              }
            ]
          }
        ]
      },
      "reflection": {
        "eyebrow": "REFLECTION",
        "blocks": [
          {
            "kind": "text",
            "paragraphs": [
              "Fintech UX is fundamentally about trust, not just clarity. Every screen is a micro-negotiation between the user's financial anxiety and the product's reliability.",
              "This project reinforced a principle I return to often: simplifying a flow doesn't always mean reducing rigour — it means designing it more intentionally. The bank mandate could easily have felt like friction, but framed correctly it became a trust signal. Complexity managed well becomes clarity for the user. I also learned to treat ops workflows as a design input, not an afterthought. The most impactful changes came from understanding where business processes broke down, not just where users did."
            ]
          }
        ]
      }
    },
    "nextProjectSlug": "sycamore-design-system"
  },
  {
    "slug": "sycamore-design-system",
    "titleLead": "SYCAMORE'S",
    "title": "DESIGN SYSTEM",
    "summary": "Building a unified design language from scratch to align product, engineering, and marketing — cutting iteration time by 40% and enabling consistent, trustworthy financial experiences at scale.",
    "tags": [
      "FINTECH",
      "SYSTEM DESIGN",
      "STYLE GUIDE"
    ],
    "meta": {
      "role": "Product Designer",